category,created_at,body,rating
Doohickey,2020-03-03 19:51:23.058,Error ex unde facilis sunt beatae consequatur. Voluptate exercitationem omnis sint. Voluptas sed et mollitia reprehenderit sit repellat explicabo esse. Atque quam qui illum illum cupiditate.,2
Doohickey,2020-02-09 16:37:57.670,Beatae voluptatem est labore dicta. Cum sint cupiditate adipisci nesciunt tenetur harum corrupti. Sint id tempora ipsa provident laudantium magnam. Et illo iure perspiciatis vel qui.,3
Doohickey,2020-02-03 11:15:53.031,Ducimus dignissimos sint et consequatur enim est aut. Eaque et eum enim adipisci. Quae eos sed a.,3
Doohickey,2020-01-06 12:41:13.938,Maxime quibusdam impedit nostrum quo. Excepturi excepturi non sed rerum dolor quo quia. Earum rerum ut animi veritatis voluptas. Dolores omnis alias dolores.,2
Doohickey,2019-12-23 02:17:45.573,Cumque blanditiis cumque debitis praesentium voluptatem temporibus praesentium. Beatae aut aspernatur dolorem quisquam magni distinctio voluptatem. Pariatur quaerat nam culpa consequuntur tempora voluptate vero. Rerum asperiores in doloremque eum recusandae nisi.,3
Doohickey,2019-12-16 00:36:41.039,Quaerat iusto vitae consequatur dolor in ducimus odit. Fugiat illo sunt id aperiam iste enim ullam consequatur. Dolor consequatur veniam consequuntur aut ut molestiae et. Laborum qui aut debitis sequi. Aliquam eos vel dolore iure provident ut consequatur est.,3
Doohickey,2019-11-25 15:04:32.838,Placeat laboriosam ullam ratione rerum. Eligendi maiores delectus totam quibusdam in porro. Non sint maiores sunt odio est. Sed odit sint voluptas reprehenderit cumque.,3
Doohickey,2019-11-22 04:12:40.052,Inventore qui dolorum dicta nam dolor consequatur non. Ea libero dolorum est fugiat voluptatem voluptatum qui. Quod minus maxime sequi.,3
Doohickey,2019-11-04 06:33:55.181,Sunt illo cum consequuntur. Dignissimos eius rerum deleniti. Fugiat omnis est quos. Et ut tenetur praesentium perspiciatis. Et cupiditate magni perspiciatis facere atque ab qui earum.,2
Doohickey,2019-10-13 11:27:50.725,Maxime nemo omnis architecto. Doloremque sed aliquid dolor expedita aut quis. Exercitationem quis maiores qui dolores quam et provident. Eum consequuntur culpa vel sit ducimus nostrum. Commodi officia qui non fugit architecto sed provident tempora.,2
Doohickey,2019-10-05 23:04:29.728,Est voluptatem est nihil ab. Omnis numquam consequatur rem. Cumque cum qui quia est nihil ex. Corrupti repudiandae quos sequi magnam ea.,2
Doohickey,2019-09-14 03:22:59.781,Eveniet voluptatem quaerat est recusandae eveniet aut. Nihil quas autem distinctio saepe consequatur consequatur. Ratione sed assumenda quaerat adipisci error excepturi sed. Temporibus omnis nulla sit pariatur omnis similique qui.,2
Doohickey,2019-07-17 23:52:52.821,Adipisci alias corrupti inventore est similique voluptatibus. Qui fuga quos incidunt. Sed voluptatem ad harum omnis possimus. Cumque esse aliquam occaecati laboriosam quis. Expedita doloribus tempora eius harum.,1
Doohickey,2019-04-20 04:57:57.910,Sint dicta facere cumque omnis autem. Non tempora voluptatem iure. Modi quia modi voluptatem. Autem ratione tempora qui.,3
Doohickey,2019-04-15 22:18:56.792,Voluptas illum officiis facere. Quas iure ut praesentium et. Sed soluta explicabo esse doloribus sed.,3
Doohickey,2019-04-02 15:45:36.848,Quod accusantium qui itaque aut optio. Reprehenderit est quo beatae. Qui totam voluptatum nisi a qui est repellat. Quia voluptatibus dolor veritatis minima. Magni nostrum ex rerum omnis omnis.,2
Doohickey,2019-02-02 19:47:40.714,Modi quibusdam aut cumque animi consequuntur sapiente. Ratione eligendi nostrum perferendis qui quia rerum. Eos quia veniam ducimus est perferendis iste quo.,1
Doohickey,2019-01-17 19:37:40.230,Rem et autem voluptas dolor quas inventore aut dolore. Aperiam dolor nisi voluptas voluptate repellendus corrupti. Dignissimos facilis sapiente voluptatem dolor. Inventore error delectus eius ducimus. Qui praesentium accusamus harum.,2
Doohickey,2018-11-06 09:23:59.664,Inventore eos aut error commodi dolor quasi id sunt. Ab consequatur eligendi et aliquam et. Laborum similique omnis ab harum.,1
Doohickey,2018-10-05 18:18:12.074,Reprehenderit est neque sapiente at dolore aut facilis. Ea reprehenderit ut dicta et quia harum repellendus. Provident facilis nostrum quidem. Velit quod nobis dolore aspernatur suscipit.,3
Doohickey,2018-09-28 22:29:23.619,Ad sit magnam voluptatem esse voluptatem. Natus ut quo labore soluta ex exercitationem. Sunt aperiam qui at.,2
Doohickey,2018-09-28 02:16:05.922,Id sed aut quo est. Vero et nobis numquam quis. Asperiores laudantium in reprehenderit quisquam. Architecto accusantium eaque adipisci. Sequi error doloremque quaerat laboriosam incidunt.,2
Doohickey,2018-09-13 02:37:59.264,A occaecati consequatur sit ab quia dolor. Rem est laudantium qui nisi perspiciatis inventore porro. Velit eos praesentium sequi et. Repellendus ut debitis qui magnam perferendis et totam.,3
Doohickey,2018-07-28 13:49:57.756,Necessitatibus voluptatem officia iusto. Repudiandae distinctio accusantium quae officiis nisi. Eveniet voluptatem non molestias tempora maxime voluptas quas reiciendis. Explicabo ea non enim temporibus. Alias aspernatur quos et quia blanditiis repudiandae.,1
Doohickey,2018-06-25 23:24:21.905,Quia velit sapiente quia voluptatem accusantium. Quod ut a nulla ea. Velit tempore sit blanditiis placeat hic maiores reiciendis et. Consequatur tempora non explicabo necessitatibus cumque fuga cumque. Voluptatem ut tempora velit temporibus in et iure.,1
Doohickey,2018-04-29 05:54:53.293,Et non est minima praesentium est. Nesciunt ipsa omnis est voluptatem provident dolores consequatur qui. Quos est architecto exercitationem soluta delectus adipisci minima.,3
Doohickey,2018-04-08 17:16:25.326,Rerum eius vero blanditiis dignissimos soluta ut ipsum sint. Repellendus incidunt et occaecati molestiae cupiditate similique possimus. Veniam laudantium illo quaerat non porro. Perferendis alias laudantium deleniti.,2
Doohickey,2018-03-26 10:17:08.367,Corrupti tenetur nisi ut minima est facere nisi. Consequatur perferendis corporis vel pariatur. Et deleniti vero et aut facilis illum temporibus debitis.,2
Doohickey,2018-03-03 12:35:19.802,Ex excepturi praesentium est sed vero maxime. Et numquam neque reprehenderit voluptatem maxime. Minus voluptas error molestiae aut. Optio omnis quod voluptatem.,1
Doohickey,2018-02-27 14:51:45.159,Odit nihil expedita dolor qui nisi tempore. Doloribus saepe ea nostrum sequi error. Et doloribus id at corporis autem. Illum quasi deleniti voluptatem doloremque nam.,1
Doohickey,2018-02-16 02:56:08.759,Perspiciatis sed a eius aut saepe repellendus deleniti error. Quia ducimus placeat eum deserunt nobis in. Dolor molestiae sunt itaque voluptate fugiat dicta ea. Et distinctio incidunt rem inventore dicta ducimus velit est.,1
Doohickey,2018-01-27 03:21:15.250,Et perspiciatis deserunt asperiores laudantium necessitatibus excepturi. Omnis assumenda reprehenderit voluptatibus. Nulla blanditiis ea reprehenderit aut.,1
Doohickey,2017-12-20 06:34:49.464,Nemo non adipisci in et quam ab. Quo accusamus vel sit. Ipsum et provident fuga est quidem. Vero omnis eos molestias nulla. Qui enim nulla necessitatibus.,2
Doohickey,2017-10-24 21:09:20.064,Voluptas voluptas minima odio est. Itaque tenetur nam illo cum. Illum reprehenderit id quaerat tempora rerum officia. Consequuntur eveniet nesciunt porro. Rerum laudantium dolores esse.,1
Doohickey,2017-10-01 01:04:25.318,Illo voluptatem sit quod nobis inventore qui amet saepe. Blanditiis eveniet blanditiis rerum qui id. Qui cum excepturi fuga fugiat. Molestiae voluptatum error iusto eos at. Voluptas non explicabo architecto in cum officiis.,1
Doohickey,2017-09-16 05:10:09.763,Delectus quos qui itaque incidunt recusandae. Quae ea sit exercitationem quia impedit. Et voluptates explicabo velit velit. Reiciendis consectetur recusandae consequatur in.,1
Doohickey,2017-08-19 08:05:56.402,Sed at et impedit enim aspernatur ipsa. Et iste voluptatem reprehenderit voluptate qui repellendus consequatur autem. Omnis autem enim aperiam.,2
Doohickey,2017-08-16 22:10:41.084,Perferendis non nihil facilis consequuntur sed ratione minus. Quaerat magni veritatis labore iusto deleniti eveniet. Voluptatum numquam et enim.,2
Doohickey,2017-05-17 15:21:00.482,Eligendi sequi quibusdam esse qui fuga provident deleniti. Quaerat doloribus qui et. Facilis illo tempore ex. Et libero ea impedit. Odio eaque odio assumenda est et quia.,2
Doohickey,2017-04-08 23:43:57.502,Eius animi esse temporibus rem. Vitae qui nobis ut et sint eligendi. Eos reiciendis id sapiente et voluptatibus dignissimos. Accusamus et consectetur est omnis ipsam. Veritatis voluptate et velit deserunt nemo laborum libero ad.,3
Doohickey,2017-04-07 23:14:36.659,Fugit ut accusamus eaque. Sequi ad vel vitae iure adipisci eos eligendi maiores. Dicta minima minus commodi ea reprehenderit. Voluptatem aspernatur eum sit dolor veritatis aut.,1
Doohickey,2016-12-10 15:46:07.837,Nemo omnis dignissimos eligendi. Quod nesciunt dolorum sit incidunt ipsam. Reiciendis odio eius blanditiis nobis quia cum veritatis sapiente. Ad rerum quasi eum corrupti. Soluta asperiores vitae placeat ipsam suscipit odit minus.,3
Doohickey,2016-06-08 08:54:57.329,Ut et quia sint. Sed repudiandae assumenda aspernatur. Neque ipsum incidunt possimus voluptates ut dicta ab. Dolores facilis nostrum aut sunt autem. Sint impedit et recusandae dignissimos distinctio voluptas.,2
Doohickey,2016-06-06 08:07:04.209,Et voluptate ut magnam aspernatur. Cupiditate a eos nihil harum distinctio voluptatem qui quasi. Laborum aut nostrum rem odit.,3
